{
  "schemaVersion": "underwriter-allocation/v1",
  "allocationId": "allocation_code_agent_001",
  "poolId": "pool_stake_code_001",
  "agentId": "agent_code_001",
  "taskClass": "code.patch",
  "allocatedCapacityUSDC": "500000000",
  "lockedCapacityUSDC": "0",
  "availableCapacityUSDC": "500000000",
  "validFrom": "2026-05-21T12:00:00.000Z",
  "validUntil": "2026-06-20T12:00:00.000Z",
  "status": "active"
}
